{
  "$schema": "../schema.json",
  "schema_version": "1.1.0",
  "record_id": "serock-1884-birth-37",
  "register": {
    "town": "Serock",
    "fond": "73/826/0",
    "year": 1884,
    "act_type": "birth",
    "act_no": 37,
    "language": "ru",
    "clerk_year": {
      "id": "73-826-0|serock|1884|clerk-unknown",
      "basis": "REGISTER_YEAR_PROXY",
      "clerk_id": null
    }
  },
  "artifact": {
    "status": "NOT_LOCALIZED",
    "path": null,
    "sha256": null,
    "source_spans_captured": false
  },
  "provenance": {
    "source_note": "E:\\DNA\\Helene_Research\\Majer_Thirteen_Children.md",
    "source_note_sha256": "c6dbdf1d2e903bc7da4e1ad1a520ec3a879878eb6ecedfcec5daca9472d77baf",
    "source_locator": "§3.2 Abram and Minia/Mania Fajga household",
    "source_author": "Agent C-2",
    "restricted_sources_used": false
  },
  "annotation": {
    "tier": "PROJECT_VERIFIED_RESEARCH_NOTE",
    "expert_verified": false,
    "evaluation_eligible": true,
    "correction_consent": {
      "status": "NOT_RECORDED",
      "training_eligible": false
    },
    "correction_history": []
  },
  "privacy": {
    "decision": "ALLOW",
    "basis": "pre-1915 civil act; older than the configured 100-year default",
    "evaluated_on": "2026-07-28"
  },
  "fields": {
    "act_type": {
      "value": "birth",
      "original_script": null,
      "confidence": "PROBABLE",
      "observation_state": "PRESENT",
      "alternatives": [],
      "source_spans": [
        {
          "kind": "research_note",
          "source_note": "E:\\DNA\\Helene_Research\\Majer_Thirteen_Children.md",
          "locator": "§3.2 Abram and Minia/Mania Fajga household"
        }
      ],
      "transcription_status": "NOT_RECORDED_IN_SOURCE_NOTE"
    },
    "act_no": {
      "value": 37,
      "original_script": null,
      "confidence": "PROBABLE",
      "observation_state": "PRESENT",
      "alternatives": [],
      "source_spans": [
        {
          "kind": "research_note",
          "source_note": "E:\\DNA\\Helene_Research\\Majer_Thirteen_Children.md",
          "locator": "§3.2 Abram and Minia/Mania Fajga household"
        }
      ],
      "transcription_status": "NOT_RECORDED_IN_SOURCE_NOTE"
    },
    "year": {
      "value": 1884,
      "original_script": null,
      "confidence": "PROBABLE",
      "observation_state": "PRESENT",
      "alternatives": [],
      "source_spans": [
        {
          "kind": "research_note",
          "source_note": "E:\\DNA\\Helene_Research\\Majer_Thirteen_Children.md",
          "locator": "§3.2 Abram and Minia/Mania Fajga household"
        }
      ],
      "transcription_status": "NOT_RECORDED_IN_SOURCE_NOTE"
    },
    "registration_date": {
      "value": null,
      "original_script": null,
      "confidence": null,
      "observation_state": "NOT_ANNOTATED",
      "alternatives": [],
      "source_spans": [],
      "transcription_status": "NOT_APPLICABLE"
    },
    "event_date": {
      "value": {
        "year": 1884,
        "month": 7,
        "precision": "month"
      },
      "original_script": null,
      "confidence": "PROBABLE",
      "observation_state": "PRESENT",
      "alternatives": [],
      "source_spans": [
        {
          "kind": "research_note",
          "source_note": "E:\\DNA\\Helene_Research\\Majer_Thirteen_Children.md",
          "locator": "§3.2 Abram and Minia/Mania Fajga household"
        }
      ],
      "transcription_status": "NOT_RECORDED_IN_SOURCE_NOTE"
    },
    "town": {
      "value": "Serock",
      "original_script": null,
      "confidence": "PROBABLE",
      "observation_state": "PRESENT",
      "alternatives": [],
      "source_spans": [
        {
          "kind": "research_note",
          "source_note": "E:\\DNA\\Helene_Research\\Majer_Thirteen_Children.md",
          "locator": "§3.2 Abram and Minia/Mania Fajga household"
        }
      ],
      "transcription_status": "NOT_RECORDED_IN_SOURCE_NOTE"
    },
    "principal": {
      "name": {
        "value": "Icek Moszek Goldsztejn",
        "original_script": null,
        "confidence": "PROBABLE",
        "observation_state": "PRESENT",
        "alternatives": [],
        "source_spans": [
          {
            "kind": "research_note",
            "source_note": "E:\\DNA\\Helene_Research\\Majer_Thirteen_Children.md",
            "locator": "§3.2 Abram and Minia/Mania Fajga household"
          }
        ],
        "transcription_status": "NOT_RECORDED_IN_SOURCE_NOTE"
      },
      "maiden_name": {
        "value": null,
        "original_script": null,
        "confidence": null,
        "observation_state": "NOT_ANNOTATED",
        "alternatives": [],
        "source_spans": [],
        "transcription_status": "NOT_APPLICABLE"
      },
      "age": {
        "value": null,
        "original_script": null,
        "confidence": null,
        "observation_state": "NOT_ANNOTATED",
        "alternatives": [],
        "source_spans": [],
        "transcription_status": "NOT_APPLICABLE"
      },
      "occupation": {
        "value": null,
        "original_script": null,
        "confidence": null,
        "observation_state": "NOT_ANNOTATED",
        "alternatives": [],
        "source_spans": [],
        "transcription_status": "NOT_APPLICABLE"
      },
      "residence": {
        "value": null,
        "original_script": null,
        "confidence": null,
        "observation_state": "NOT_ANNOTATED",
        "alternatives": [],
        "source_spans": [],
        "transcription_status": "NOT_APPLICABLE"
      },
      "birthplace": {
        "value": null,
        "original_script": null,
        "confidence": null,
        "observation_state": "NOT_ANNOTATED",
        "alternatives": [],
        "source_spans": [],
        "transcription_status": "NOT_APPLICABLE"
      },
      "sex": {
        "value": null,
        "original_script": null,
        "confidence": null,
        "observation_state": "NOT_ANNOTATED",
        "alternatives": [],
        "source_spans": [],
        "transcription_status": "NOT_APPLICABLE"
      },
      "marital_status": {
        "value": null,
        "original_script": null,
        "confidence": null,
        "observation_state": "NOT_ANNOTATED",
        "alternatives": [],
        "source_spans": [],
        "transcription_status": "NOT_APPLICABLE"
      },
      "relationship": {
        "value": null,
        "original_script": null,
        "confidence": null,
        "observation_state": "NOT_ANNOTATED",
        "alternatives": [],
        "source_spans": [],
        "transcription_status": "NOT_APPLICABLE"
      }
    },
    "father": {
      "name": {
        "value": "Abram Goldsztejn",
        "original_script": null,
        "confidence": "PROBABLE",
        "observation_state": "PRESENT",
        "alternatives": [],
        "source_spans": [
          {
            "kind": "research_note",
            "source_note": "E:\\DNA\\Helene_Research\\Majer_Thirteen_Children.md",
            "locator": "§3.2 Abram and Minia/Mania Fajga household"
          }
        ],
        "transcription_status": "NOT_RECORDED_IN_SOURCE_NOTE"
      },
      "maiden_name": {
        "value": null,
        "original_script": null,
        "confidence": null,
        "observation_state": "NOT_ANNOTATED",
        "alternatives": [],
        "source_spans": [],
        "transcription_status": "NOT_APPLICABLE"
      },
      "age": {
        "value": null,
        "original_script": null,
        "confidence": null,
        "observation_state": "NOT_ANNOTATED",
        "alternatives": [],
        "source_spans": [],
        "transcription_status": "NOT_APPLICABLE"
      },
      "occupation": {
        "value": "[unclear: trader/laborer]",
        "original_script": null,
        "confidence": "UNCLEAR",
        "observation_state": "PRESENT",
        "alternatives": [
          "trader",
          "laborer"
        ],
        "source_spans": [
          {
            "kind": "research_note",
            "source_note": "E:\\DNA\\Helene_Research\\Majer_Thirteen_Children.md",
            "locator": "§3.2 Abram and Minia/Mania Fajga household"
          }
        ],
        "transcription_status": "NOT_RECORDED_IN_SOURCE_NOTE"
      },
      "residence": {
        "value": "Serock",
        "original_script": null,
        "confidence": "PROBABLE",
        "observation_state": "PRESENT",
        "alternatives": [],
        "source_spans": [
          {
            "kind": "research_note",
            "source_note": "E:\\DNA\\Helene_Research\\Majer_Thirteen_Children.md",
            "locator": "§3.2 Abram and Minia/Mania Fajga household"
          }
        ],
        "transcription_status": "NOT_RECORDED_IN_SOURCE_NOTE"
      },
      "birthplace": {
        "value": null,
        "original_script": null,
        "confidence": null,
        "observation_state": "NOT_ANNOTATED",
        "alternatives": [],
        "source_spans": [],
        "transcription_status": "NOT_APPLICABLE"
      },
      "sex": {
        "value": null,
        "original_script": null,
        "confidence": null,
        "observation_state": "NOT_ANNOTATED",
        "alternatives": [],
        "source_spans": [],
        "transcription_status": "NOT_APPLICABLE"
      },
      "marital_status": {
        "value": null,
        "original_script": null,
        "confidence": null,
        "observation_state": "NOT_ANNOTATED",
        "alternatives": [],
        "source_spans": [],
        "transcription_status": "NOT_APPLICABLE"
      },
      "relationship": {
        "value": null,
        "original_script": null,
        "confidence": null,
        "observation_state": "NOT_ANNOTATED",
        "alternatives": [],
        "source_spans": [],
        "transcription_status": "NOT_APPLICABLE"
      }
    },
    "mother": {
      "name": {
        "value": "[unclear: Minia Fajga/Mania Fajga]",
        "original_script": null,
        "confidence": "UNCLEAR",
        "observation_state": "PRESENT",